<?xml version="1.0" encoding="UTF-8"?>
<!--
# Licensed under the Apache License, Version 2.0 (the "License");
# you may not use this file except in compliance with the License.
# You may obtain a copy of the License at
#
#      https://www.apache.org/licenses/LICENSE-2.0
#
# Unless required by applicable law or agreed to in writing, software
# distributed under the License is distributed on an "AS IS" BASIS,
# WITHOUT WARRANTIES OR CONDITIONS OF ANY KIND, either express or implied.
# See the License for the specific language governing permissions and
# limitations under the License.
-->
<!--
 | Master machine list. Includes:
 | - Non-functional information for team members 
 | - Functional stuff for Axxon (via a transform)
 | - Functional stuff for job submission tool (via a transform)
 |
 | Machine and host elements in this list are created and modified
 | automatically by editing tools, or can be created by hand. In the
 | latter case, ensure your changes validate successfully with the
 | corresponding stylesheet (master_machine_list.xsd).
 -->


<machinelist xmlns:xsi="http://www.w3.org/2001/XMLSchema-instance" xsi:noNamespaceSchemaLocation="master_machine_list.xsd">
    <defaults><!-- Add values to this section to make them appear as selections in the editor. -->
        <ostypes>
            <os type="Linux"/>
            <os type="Windows"/>
            <os type="AIX"/>
            <os type="MVS"/>
            <os type="HP-UX"/>
            <os type="Solaris"/>
            <os type="Darwin"/>
        </ostypes>
        <bitcounts>
            <bits>32</bits>
            <bits>64</bits>
            <bits>31</bits>
        </bitcounts>
        <axxonlogintypes>
            <shell>STAF</shell>
            <shell>SSH</shell>
        </axxonlogintypes>
        <axxonloginids>
            <username>jbench</username>
            <username>bench</username>
        </axxonloginids>
        <cputypes>
            <cputype>x86</cputype>
            <cputype>AMD64</cputype>
            <cputype>PPC</cputype>
            <cputype>PPCLE</cputype>
            <cputype>z Series</cputype>
            <cputype>PA-RISC</cputype>
            <cputype>Itanium</cputype>
            <cputype>SPARC</cputype>
        </cputypes>
        <threadingtypes>
            <threading>none</threading>
            <threading>SMT</threading>
            <threading>HT</threading>
        </threadingtypes>
        <netspeeds>
            <interface>
                <speed units="Mbit"/>
                <speed units="Gbit"/>
            </interface>
        </netspeeds>
        <addresstypes>
            <address type="IPv4"/>
            <address type="IPv6"/>
        </addresstypes>
        <cpuspeeds>
            <cpus>
                <speed units="MHz"/>
                <speed units="GHz"/>
            </cpus>
        </cpuspeeds>
        <memoryspeeds>
            <memory>
                <speed units="MHz"/>
                <speed units="GHz"/>
            </memory>
        </memoryspeeds>
        <memorysizes>
            <memory>
                <capacity units="MB"/>
                <capacity units="GB"/>
            </memory>
        </memorysizes>
    </defaults>
    <template><!-- Templates for machine and host entries. -->
        <machine id="0">
            <name/>
            <serial/>
            <manufacturer/>
            <model/>
            <description/>
            <location>
                <room/>
                <site/>
                <country/>
            </location>
            <owners>
                <owner id="1" type="eAMT"/>
            </owners>
            <architecture>
                <cpuvendor/>
                <cpuname/>
                <cputype>x86</cputype>
                <bits>32</bits>
            </architecture>
            <hardware>
                <cpus>
                    <physical>1</physical>
                    <logical>1</logical>
                    <threading>none</threading>
                    <speed units="MHz">1</speed>
                </cpus>
                <fsbspeed units="MHz">1</fsbspeed>
                <caches>
                    <cache id="1" type="L1" units="KB">0</cache>
                    <notes/>
                </caches>
                <memory type="DDR">
                    <speed units="MHz">1</speed>
                    <capacity units="MB">1</capacity>
                </memory>
                <network>
                    <interface type="Ethernet" id="1">
                        <port/>
                        <speed units="Mbit">1</speed>
                    </interface>
                </network>
            </hardware>
        </machine>
        <host id="0">
            <name/>
            <domain/>
            <machine id="0"/>
            <description/>
            <os type="Linux"/>
            <addresses>
                <address id="1" hostname="hostname" type="IPv4" interface="1">1.2.3.4</address>
            </addresses>
            <axxon enabled="false">
                <shell>STAF</shell>
                <username>jbench</username>
                <capabilities/>
            </axxon>
            <jobgenerator enabled="false">
                <capabilities/>
                <restrictions/>
            </jobgenerator>
            <STAF trust="true">
                <entries/>
                <vars/>
            </STAF>
        </host>
    </template>
    <machines>
        <machine id="171">
            <name>Kermit</name>
            <serial/>
            <manufacturer>Intel</manufacturer>
            <model>Intel(R) Xeon(R) CPU E5-2697 v4 @ 2.30GHz</model>
            <description>Broadwell</description>
            <location>
                <room>Heavy Lab</room>
                <site>Toronto</site>
                <country>Canada</country>
            </location>
            <owners>
                <owner id="1" type="eAMT">piyush286</owner>
            </owners>
            <architecture>
                <cpuvendor>Intel</cpuvendor>
                <cpuname>E5-2697 v4</cpuname>
                <cputype>AMD64</cputype>
                <bits>64</bits>
                <compatible id="1">
                    <cputype>x86</cputype>
                    <bits>32</bits>
                </compatible>
            </architecture>
            <hardware>
                <cpus>
                    <physical>36</physical>
                    <logical>72</logical>
                    <threading>SMT</threading>
                    <speed units="GHz">2.3</speed>
                </cpus>
                <fsbspeed units="MHz">1200</fsbspeed>
                <caches>
                    <cache id="1" type="L1d" units="KB">32</cache>
                    <cache id="2" type="L1i" units="KB">32</cache>
                    <notes/>
                </caches>
                <memory type="DDR">
                    <speed units="MHz">1200</speed>
                    <capacity units="GB">528</capacity>
                </memory>
                <network>
                    <interface id="1" type="Ethernet">
                        <port>BFS</port>
                        <speed units="Mbit">100</speed>
                    </interface>
                    <interface id="2" type="Ethernet">
                        <port>10G</port>
                        <speed units="Gbit">10</speed>
                    </interface>
                </network>
            </hardware>
        </machine>
    </machines>
    <hosts>
        <host id="242">
            <name>kermit</name>
            <domain>customServer.com</domain>
            <machine id="171"/>
            <description/>
            <os type="Linux">Ubuntu 16.04</os>
            <addresses>
                <address id="1" hostname="kermit" type="IPv4" interface="1">9.26.52.72</address>
                <address id="2" hostname="kermit10G" type="IPv4" interface="2">192.168.1.83</address>
            </addresses>
            <axxon enabled="true">
                <shell>STAF</shell>
                <username>jbench</username>
                <capabilities/>
            </axxon>
            <jobgenerator enabled="true">
                <capabilities>
                    <capability id="1" name="perffarm" bits="all">
                        <property id="1" name="JDKDirectory">/java/perffarm/sdks</property>
                        <property id="2" name="resultsDir">/usr/local/wasperfauto/results</property>
                        <property id="3" name="resultsID"/>
                        <property id="4" name="wasperfauto_version">{WPA/inst1/root}</property>
                        <property id="5" name="dumpDir">/dump</property>
                    </capability>
                    <capability id="7" name="StartupDT" bits="all">
                        <property id="1" name="appSrvProfile">StartupDT</property>
                        <property id="2" name="appSrvInstanceName">DayTrader30</property>
                        <property id="3" name="appSrvUserName">wasadmin</property>
                        <property id="4" name="appSrvPassword">wasadmin</property>
                    </capability>
                    <capability id="10" name="SOABench" bits="all">
                        <property id="1" name="clientMachines">perfxposh10G</property>
                        <property id="2" name="appSrvProfile">SOABench</property>
                        <property id="3" name="appSrvInstanceName">SOABench</property>
                    </capability>
                    <capability id="17" name="4way" bits="all">
                        <property id="1" name="CPUAffinity"> numactl --physcpubind=0,1,36,37 --membind=0</property>
                        <property id="2" name="CPUAffinityLiberty">numactl --physcpubind=0-3 --membind=0</property>
                        <property id="3" name="CPUAffinityILOG_WODM">numactl --physcpubind=0,1,36,37 --membind=0</property>